[
  {
    "sku": "VBP-2024-BLK",
    "name": "VoltBuds Pro Wireless Earbuds",
    "short_name": "VoltBuds Pro",
    "category": "audio",
    "subcategory": "earbuds",
    "price_usd": 79.99,
    "compare_at_price_usd": 99.99,
    "currency": "USD",
    "description": "True-wireless earbuds with 8-hour battery, Bluetooth 5.3, and IPX5 water resistance. Dual-mic ENC for calls. Multipoint pairing with 2 devices.",
    "color": "Midnight Black",
    "available_colors": ["Midnight Black", "Arctic White", "Sage Green"],
    "in_stock": true,
    "stock_quantity": 342,
    "weight_grams": 45,
    "dimensions_cm": {
      "length": 6.0,
      "width": 5.0,
      "height": 3.0
    },
    "shipping": {
      "domestic_eligible": true,
      "international_eligible": true,
      "lithium_battery": true,
      "battery_wh": 2.5,
      "restricted_regions": []
    },
    "warranty_months": 12,
    "return_window_days": 30,
    "rating": 4.6,
    "review_count": 2341,
    "tags": ["wireless", "bluetooth", "water_resistant", "multipoint"],
    "related_skus": ["VBM-2024-BLK", "VC65-WHT"],
    "launch_date": "2020-08-15",
    "last_updated": "2026-01-15"
  },
  {
    "sku": "VBM-2024-BLK",
    "name": "VoltBoom Bluetooth Speaker",
    "short_name": "VoltBoom",
    "category": "audio",
    "subcategory": "speaker",
    "price_usd": 59.99,
    "compare_at_price_usd": 74.99,
    "currency": "USD",
    "description": "Portable Bluetooth speaker with 360° sound, IP67 waterproofing, and 24-hour battery. Pair up to 100 speakers in Party mode.",
    "color": "Midnight Black",
    "available_colors": ["Midnight Black", "Storm Gray"],
    "in_stock": true,
    "stock_quantity": 218,
    "weight_grams": 680,
    "dimensions_cm": {
      "length": 18.0,
      "width": 8.0,
      "height": 8.0
    },
    "shipping": {
      "domestic_eligible": true,
      "international_eligible": true,
      "lithium_battery": true,
      "battery_wh": 14.8,
      "restricted_regions": []
    },
    "warranty_months": 12,
    "return_window_days": 30,
    "rating": 4.5,
    "review_count": 1847,
    "tags": ["wireless", "bluetooth", "waterproof", "portable", "party_mode"],
    "related_skus": ["VBP-2024-BLK", "VB20-BLK"],
    "launch_date": "2021-04-10",
    "last_updated": "2026-01-15"
  },
  {
    "sku": "VC65-WHT",
    "name": "VoltCharge 65W USB-C Charger",
    "short_name": "VoltCharge 65W",
    "category": "power",
    "subcategory": "wall_charger",
    "price_usd": 39.99,
    "compare_at_price_usd": 49.99,
    "currency": "USD",
    "description": "Compact GaN wall charger with 2× USB-C and 1× USB-A ports. Powers laptops, phones, and tablets at up to 65W.",
    "color": "White",
    "available_colors": ["White", "Black"],
    "in_stock": true,
    "stock_quantity": 512,
    "weight_grams": 135,
    "dimensions_cm": {
      "length": 5.5,
      "width": 5.5,
      "height": 3.0
    },
    "shipping": {
      "domestic_eligible": true,
      "international_eligible": true,
      "lithium_battery": false,
      "battery_wh": 0,
      "restricted_regions": []
    },
    "warranty_months": 12,
    "return_window_days": 30,
    "rating": 4.7,
    "review_count": 3102,
    "tags": ["gan", "usb_c", "fast_charging", "laptop_charger", "travel"],
    "related_skus": ["VB20-BLK", "VBP-2024-BLK"],
    "launch_date": "2022-02-01",
    "last_updated": "2026-01-15"
  },
  {
    "sku": "VB20-BLK",
    "name": "VoltBank 20K Power Bank",
    "short_name": "VoltBank 20K",
    "category": "power",
    "subcategory": "power_bank",
    "price_usd": 49.99,
    "compare_at_price_usd": 59.99,
    "currency": "USD",
    "description": "20,000 mAh power bank with 65W laptop-capable output and digital LED display. Recharges in 2 hours via 65W USB-C.",
    "color": "Midnight Black",
    "available_colors": ["Midnight Black"],
    "in_stock": true,
    "stock_quantity": 189,
    "weight_grams": 420,
    "dimensions_cm": {
      "length": 15.5,
      "width": 7.3,
      "height": 2.5
    },
    "shipping": {
      "domestic_eligible": true,
      "international_eligible": false,
      "lithium_battery": true,
      "battery_wh": 74,
      "restricted_regions": ["international"],
      "restriction_reason": "Lithium battery exceeds international air transport limits for retail shipments"
    },
    "warranty_months": 12,
    "return_window_days": 30,
    "rating": 4.4,
    "review_count": 1562,
    "tags": ["power_bank", "laptop_charger", "usb_c", "travel", "flight_approved"],
    "related_skus": ["VC65-WHT", "VBP-2024-BLK"],
    "launch_date": "2022-09-15",
    "last_updated": "2026-01-15"
  },
  {
    "sku": "VSC-2024-CLR",
    "name": "VoltShield Phone Case",
    "short_name": "VoltShield",
    "category": "protection",
    "subcategory": "phone_case",
    "price_usd": 24.99,
    "compare_at_price_usd": null,
    "currency": "USD",
    "description": "Slim protective phone case with 3-meter drop protection and MagSafe compatibility. Available for iPhone, Samsung Galaxy, and Google Pixel.",
    "color": "Crystal Clear",
    "available_colors": ["Crystal Clear", "Midnight Black", "Desert Tan"],
    "in_stock": true,
    "stock_quantity": 874,
    "weight_grams": 32,
    "dimensions_cm": {
      "length": 16.0,
      "width": 8.0,
      "height": 1.2
    },
    "shipping": {
      "domestic_eligible": true,
      "international_eligible": true,
      "lithium_battery": false,
      "battery_wh": 0,
      "restricted_regions": []
    },
    "warranty_months": 12,
    "return_window_days": 30,
    "rating": 4.7,
    "review_count": 4218,
    "tags": ["magsafe", "drop_protection", "wireless_charging", "antimicrobial"],
    "related_skus": ["VFB-2024-BLK"],
    "launch_date": "2024-03-20",
    "last_updated": "2026-01-15"
  },
  {
    "sku": "VFB-2024-BLK",
    "name": "VoltFit Smartwatch Band",
    "short_name": "VoltFit",
    "category": "wearables",
    "subcategory": "watch_band",
    "price_usd": 19.99,
    "compare_at_price_usd": null,
    "currency": "USD",
    "description": "Comfortable replacement smartwatch band in silicone or nylon weave. Compatible with Apple Watch, Samsung Galaxy Watch, and Garmin.",
    "color": "Midnight Black",
    "available_colors": ["Midnight Black", "Ocean Blue", "Rose Gold", "Forest Green"],
    "in_stock": true,
    "stock_quantity": 1263,
    "weight_grams": 18,
    "dimensions_cm": {
      "length": 25.0,
      "width": 2.0,
      "height": 0.3
    },
    "shipping": {
      "domestic_eligible": true,
      "international_eligible": true,
      "lithium_battery": false,
      "battery_wh": 0,
      "restricted_regions": []
    },
    "warranty_months": 12,
    "return_window_days": 30,
    "rating": 4.5,
    "review_count": 2814,
    "tags": ["watch_band", "waterproof", "hypoallergenic", "quick_release"],
    "related_skus": ["VSC-2024-CLR", "VBP-2024-BLK"],
    "launch_date": "2024-11-05",
    "last_updated": "2026-01-15"
  }
]